[
  {
    "bands": {
      "Medium": 3,
      "Simple": 5
    },
    "complex_units": 0,
    "complexity": "Simple",
    "complexity_avg": 1.69,
    "complexity_max": 7,
    "complexity_score": 6.89,
    "component": "orders-web",
    "dead_code_candidates": 1,
    "duplicated_lines": 24,
    "duplication_pct": 4.1,
    "evidence": [
      {
        "file": "build.xml",
        "line": null,
        "snippet": null
      }
    ],
    "fan_in_max": 3,
    "fan_out_max": 3,
    "files": 35,
    "id": "metric:7a90f74d2945f65a",
    "loc_blank": 93,
    "loc_code": 587,
    "loc_comment": 40,
    "test_files": 1,
    "test_ratio": 0.05,
    "units": 29
  }
]
